{"$schema":"https://json-schema.org/draft/2020-12/schema","$id":"https://grandchallenge.ai/schemas/openai_ten_proofs_permanent_route_proposal.schema.json","title":"OpenAI Ten Proofs Permanent Route Proposal","type":"object","additionalProperties":false,"required":["schema_version","record_type","proposal_id","candidate_id","result_family","requested_route_id","proposal_state","tracker_issue","authority","target_scope","evidence_disposition","route_controls","activation","candidate_disposition","claim_boundary"],"properties":{"schema_version":{"const":"1.0.0"},"record_type":{"const":"openai_ten_proofs_permanent_route_proposal"},"proposal_id":{"const":"MC-OTP-ROUTE-PROPOSAL-C-PERMANENT-FORMULA"},"candidate_id":{"const":"OPENAI-TEN-PROOFS-001"},"result_family":{"const":"OTP-C-PERMANENT"},"requested_route_id":{"const":"MC-ROUTE-OTP-C-PERMANENT-FORMULA"},"proposal_state":{"const":"proposed_only"},"tracker_issue":{"const":"https://github.com/grandchallenge/MATHCERT/issues/99"},"authority":{"type":"object","additionalProperties":false,"required":["official_subject","forge_semantic","solve_handoff","cert_intake","cert_work_package","cert_replay_evidence","global_registered_route_registry_blob"],"properties":{"official_subject":{"type":"object","additionalProperties":false,"required":["repository","commit","tree","archive_sha256"],"properties":{"repository":{"const":"openai/ten-proofs"},"commit":{"$ref":"#/$defs/sha40"},"tree":{"$ref":"#/$defs/sha40"},"archive_sha256":{"$ref":"#/$defs/sha64"}}},"forge_semantic":{"type":"object","additionalProperties":false,"required":["merge","semantic_record_blob","nonvacuity_witness_blob"],"properties":{"merge":{"$ref":"#/$defs/sha40"},"semantic_record_blob":{"$ref":"#/$defs/sha40"},"nonvacuity_witness_blob":{"$ref":"#/$defs/sha40"}}},"solve_handoff":{"type":"object","additionalProperties":false,"required":["merge","producer_packet_blob"],"properties":{"merge":{"$ref":"#/$defs/sha40"},"producer_packet_blob":{"$ref":"#/$defs/sha40"}}},"cert_intake":{"type":"object","additionalProperties":false,"required":["merge","record_blob"],"properties":{"merge":{"$ref":"#/$defs/sha40"},"record_blob":{"$ref":"#/$defs/sha40"}}},"cert_work_package":{"type":"object","additionalProperties":false,"required":["merge","record_blob"],"properties":{"merge":{"$ref":"#/$defs/sha40"},"record_blob":{"$ref":"#/$defs/sha40"}}},"cert_replay_evidence":{"type":"object","additionalProperties":false,"required":["merge","admitted_head","record_blob","successor_registry_blob","evidence_root","manifest_blob","manifest_sha256","transport_artifact_id","transport_sha256"],"properties":{"merge":{"$ref":"#/$defs/sha40"},"admitted_head":{"$ref":"#/$defs/sha40"},"record_blob":{"$ref":"#/$defs/sha40"},"successor_registry_blob":{"$ref":"#/$defs/sha40"},"evidence_root":{"const":"evidence/openai_ten_proofs/permanent/"},"manifest_blob":{"$ref":"#/$defs/sha40"},"manifest_sha256":{"$ref":"#/$defs/sha64"},"transport_artifact_id":{"type":"integer","minimum":1},"transport_sha256":{"$ref":"#/$defs/sha64"}}},"global_registered_route_registry_blob":{"$ref":"#/$defs/sha40"}}},"target_scope":{"type":"object","additionalProperties":false,"required":["source_theorem","lean_theorems","nonvacuity_witnesses","source_projection","scope_exclusions"],"properties":{"source_theorem":{"type":"string","minLength":20},"lean_theorems":{"type":"array","minItems":2,"maxItems":2,"uniqueItems":true,"items":{"type":"string"}},"nonvacuity_witnesses":{"type":"array","minItems":2,"maxItems":2,"uniqueItems":true,"items":{"type":"string"}},"source_projection":{"type":"object","additionalProperties":false,"required":["formula_target_count","circuit_target_count","coefficient_field","dimension_threshold","log_base","division_free_variable_leaf_constant","rational_variable_leaf_constant","gate_bounds_in_route","total_leaves_vertices_in_route","historical_pdf_byte_equivalence"],"properties":{"formula_target_count":{"const":2},"circuit_target_count":{"const":0},"coefficient_field":{"const":"complex"},"dimension_threshold":{"const":32},"log_base":{"const":2},"division_free_variable_leaf_constant":{"const":128},"rational_variable_leaf_constant":{"const":192},"gate_bounds_in_route":{"const":false},"total_leaves_vertices_in_route":{"const":false},"historical_pdf_byte_equivalence":{"const":false}}},"scope_exclusions":{"type":"array","minItems":5,"items":{"type":"string","minLength":20}}}},"evidence_disposition":{"type":"object","additionalProperties":false,"required":["protected_archive_identity","solution_build","challenge_build","nonvacuity_replay","comparator","lean_kernel","nanoda","theorem_axiom_report","trust_boundary_scan","semantic_concordance","aggregate_all_dependency"],"properties":{"protected_archive_identity":{"const":"clear"},"solution_build":{"const":"pass"},"challenge_build":{"const":"pass_with_expected_comparator_boundary_sorries"},"nonvacuity_replay":{"const":"pass"},"comparator":{"const":"pass"},"lean_kernel":{"const":"accept"},"nanoda":{"const":"accept"},"theorem_axiom_report":{"const":"permitted_only"},"trust_boundary_scan":{"const":"clear"},"semantic_concordance":{"const":"protected_predecessor_reconfirmed"},"aggregate_all_dependency":{"const":"absent"}}},"route_controls":{"type":"object","additionalProperties":false,"required":["global_registered_route_registry_modified","route_registry_entry","may_register_route","may_adjudicate","cert_output","mathematical_target_proved","may_promote_claim","aggregate_route","aggregate_adjudication"],"properties":{"global_registered_route_registry_modified":{"const":false},"route_registry_entry":{"type":"null"},"may_register_route":{"const":false},"may_adjudicate":{"const":false},"cert_output":{"type":"null"},"mathematical_target_proved":{"const":false},"may_promote_claim":{"const":false},"aggregate_route":{"const":false},"aggregate_adjudication":{"const":false}}},"activation":{"type":"object","additionalProperties":false,"required":["condition","head_change_requires_reapproval","effect"],"properties":{"condition":{"type":"string","minLength":40},"head_change_requires_reapproval":{"const":true},"effect":{"const":"permanent_formula_route_proposal_admitted_no_registration_no_adjudication"}}},"candidate_disposition":{"const":"PERMANENT_FORMULA_CERT_ROUTE_PROPOSAL_CLEAR__REGISTRATION_NOT_YET_AUTHORIZED"},"claim_boundary":{"type":"string","minLength":250}},"$defs":{"sha40":{"type":"string","pattern":"^[0-9a-f]{40}$"},"sha64":{"type":"string","pattern":"^[0-9a-f]{64}$"}}}
